{"$schema":"https://json-schema.org/draft/2020-12/schema","$id":"https://tamv.online/schemas/gatewayConfig.schema.json","title":"GatewayConfig","type":"object","required":["defaultDailyLimit","ENABLE_ANUBIS_SENTINEL","ENABLE_DEKATEORL_FILTER","MAX_ANOMALY_SCORE","ENABLE_BOOKPI","version","checksum","author","orcid","doi","THCF_COHERENCE_THRESHOLD"],"properties":{"defaultDailyLimit":{"type":"integer"},"ENABLE_ANUBIS_SENTINEL":{"type":"boolean"},"ENABLE_DEKATEORL_FILTER":{"type":"boolean"},"MAX_ANOMALY_SCORE":{"type":"number"},"ENABLE_BOOKPI":{"type":"boolean"},"THCF_COHERENCE_THRESHOLD":{"type":"number"},"version":{"type":"string"},"checksum":{"type":"string","pattern":"^sha256:"},"author":{"type":"string"},"orcid":{"type":"string"},"doi":{"type":"string"}},"additionalProperties":true}
